codice della navigazione	Art. 1004. (Durata dell'assicurazione dell'aeromobile a viaggio). L'assicurazione dell'aeromobile, stipulata a viaggio, ha effetto dall'inizio delle manovre per l'involo al termine di quelle di approdo nel luogo di destinazione. L'assicurazione resta sospesa se il viaggio e' temporaneamente interrotto, salvo che l'interruzione sia prevista dalla polizza, ovvero dipenda da sinistro a carico dell'assicuratore o da condizioni atmosferiche che non consentano una sicura navigazione. L'assicurazione stipulata a viaggio cominciato prende inizio dall'ora indicata nel contratto o, in mancanza, delle ore ventiquattro del giorno della sua conclusione. 
codice della navigazione	Art. 1005. (Durata dell'assicurazione delle merci). L'assicurazione delle merci ha effetto dal momento in cui le merci sono prese in consegna dal vettore fino al momento della riconsegna delle stesse al destinatario nei magazzini del vettore, ma comunque non oltre quarantotto ore dopo il loro arrivo in detti magazzini. Se l'aeromobile, sul quale le merci sono caricate, non puo' continuare il viaggio e le merci medesime vengono inoltrate a destinazione con mezzi di trasporto terrestri o per acqua, l'assicurazione copre anche i rischi di tale trasporto. L'assicurazione stipulata a viaggio cominciato prende inizio dall'ora indicata nel contratto o, in mancanza, dalle ore ventiquattro del giorno della sua conclusione. 
codice della navigazione	Art. 1006. (Abbandono dell'aeromobile). L'assicurato puo' abbandonare all'assicuratore l'aeromobile ed esigere l'indennita' per perdita totale nei seguenti casi: a) quando l'aeromobile e' perduto o e' divenuto assolutamente inabile alla navigazione e non riparabile, oppure quando mancano sul posto i mezzi di riparazione, e questi non possono essere provveduti facendone richiesta altrove, ne' l'aeromobile puo' essere trasportato in luogo ove siano tali mezzi; b) quando l'aeromobile si presume perito; c) quando l'ammontare totale delle spese per la riparazione dei danni sofferti dall'aeromobile raggiunge i quattro quinti del suo valore assicurabile. 
codice della navigazione	Art. 1007. (Abbandono delle merci). L'assicurato puo' abbandonare all'assicuratore le merci ed esigere l'indennita' per perdita totale nei seguenti casi: a) quando le merci sono andate totalmente perdute; b) quando l'aeromobile si presume perito; c) quando, nei casi previsti dalla lettera a dell'articolo precedente, sono trascorsi dalla data della perdita o della innavigabilita' quindici giorni per le merci deperibili, o trenta giorni per quelle non deperibili, senza che le stesse siano state ricuperate e fatte proseguire a destinazione; d) quando, indipendentemente da qualsiasi spesa, i danni per deterioramento o perdita in quantita' superano i tre quarti del valore assicurabile. 
codice della navigazione	Art. 1008. (Abbandono del nolo). L'assicurato puo' abbandonare all'assicuratore il nolo da guadagnare ed esigere l'indennita' per perdita totale nei seguenti casi: a) quando il diritto al nolo e' totalmente perduto per l'assicurato; b) quando l'aeromobile si presume perito. 
codice della navigazione	Art. 1009. (Forma dell'abbandono dell'aeromobile). La dichiarazione di abbandono dell'aeromobile e quella con la quale l'assicuratore dichiara di non voler acquistare la proprieta' dell'aeromobile medesimo debbono essere fatte nella forma prescritta nell'articolo 864 e rese pubbliche ai sensi degli articoli 865 e seguenti. CAPO III Delle assicurazioni per danni a terzi sulla superficie e per danni da urto Sezione I Assicurazione obbligatoria della responsabilita' per danni a terzi sulla superficie 
codice della navigazione	Art. 1010. (Nota comprovante l'assicurazione). Nell'assicurazione per danni a terzi sulla superficie, oltre alla polizza, l'assicuratore deve rilasciare all'esercente, per i fini previsti nell'articolo 798, una nota contenente gli estremi dell'assicurazione. In caso di divergenza, le enunciazioni della nota vistata dal ministro per l'aeronautica prevalgono su quelle contenute nel contratto di assicurazione, per quanto riguarda la durata e l'estensione territoriale dell'assicurazione. 
codice della navigazione	Art. 1011. (Danni coperti). L'assicuratore risponde dei danni subiti dai terzi sulla superficie, anche in seguito ad urto, entro i limiti e nella misura fissati negli articoli 965 ((e 971)). 
codice della navigazione	Art. 1012. (Danni esclusi). L'assicuratore non risponde dei danni verificatisi fuori dei limiti territoriali indicati nella nota di assicurazione, salvo che questi limiti siano oltrepassati per causa di forza maggiore, per assistenza o salvataggio, ovvero per errore di pilotaggio, di condotta o di navigazione. ((COMMA ABROGATO DAL D.LGS. 15 MARZO 2006, N. 151)). ((Sono esclusi dall'assicurazione i danni derivati da dolo dell'esercente o dei suoi dipendenti e preposti, purche' questi ultimi abbiano agito nell'esercizio delle loro funzioni e nei limiti delle loro attribuzioni)) 
codice della navigazione	Art. 1013. (Mutamento della persona dell'esercente). In caso di mutamento della persona dell'esercente, che ha contratto l'assicurazione, questa continua nei confronti del nuovo esercente. Il precedente ed il successivo esercente devono dare immediato avviso del mutamento all'assicuratore. Ricevuto l'avviso l'assicuratore puo', entro quindici giorni, disdire il contratto con preavviso di quindici giorni. Uguale diritto spetta al nuovo esercente dal giorno del mutamento. L'assicuratore ed il nuovo esercente, che danno la disdetta, devono immediatamente farne comunicazione al ministro per l'aeronautica. Nel caso di mancato avviso all'assicuratore, l'assicurazione continua nei confronti del nuovo esercente, ma quest'ultimo e' tenuto solidalmente con il precedente al pagamento a titolo penale di un terzo del premio convenuto, quando non sia provato che l'assicuratore, a conoscenza del mutamento, non ha disdetto il contratto nei termini e con le modalita' sopra stabilite 
codice della navigazione	Art. 1014. (Proroga dell'assicurazione scaduta in corso di viaggio). L'assicurazione scaduta mentre l'aeromobile trovasi in viaggio e' prorogata di diritto fino al termine delle manovre di approdo nel luogo di destinazione, ma l'esercente deve pagare un supplemento di premio proporzionale al premio fissato nel contratto. 
codice della navigazione	Art. 1015. (Diritti del terzo danneggiato verso l'assicuratore). Il terzo danneggiato ha azione diretta contro l'assicuratore per il risarcimento del danno subito. L'assicuratore non puo' opporre al terzo alcuna causa di risoluzione ne' di nullita' del contratto avente effetto retroattivo. In ogni altro caso di scioglimento del contratto, l'assicuratore e' tenuto verso il terzo per i sinistri verificatisi sino al momento in cui la nota di assicurazione viene ritirata dal ministero per l'aeronautica, ma comunque non oltre quindici giorni da quello nel quale l'assicuratore ha notificato al ministero l'avvenuto scioglimento. L'assicuratore e' inoltre tenuto a risarcire il terzo anche nel caso che il danno sia da ritenersi escluso ai sensi del terzo comma dell'articolo 1012. Al di fuori delle eccezioni previste nei comma precedenti, l'assicuratore puo' opporre al terzo tutte le eccezioni opponibili all'esercente, nonche' quelle che l'esercente medesimo puo' opporre al danneggiato. 
codice della navigazione	Art. 1016. (Azione di rivalsa dell'assicuratore). Nei casi previsti dal secondo, terzo e quarto comma dell'articolo precedente, l'assicuratore ha azione di rivalsa contro l'esercente per la somma pagata al terzo danneggiato. Sezione II Assicurazione della responsabilita' per danni da urto 
codice della navigazione	Art. 1017. (Rischio). L'assicuratore risponde delle somme dovute dall'esercente per danni arrecati dall'aeromobile in volo per urto contro altro aeromobile in volo o contro nave in movimento, anche se, non essendovi stata collisione materiale, il danno e' cagionato da spostamento d'aria o altra causa analoga. Sono pero' esclusi dal risarcimento i danni dipendenti da una delle cause previste ((nel secondo comma dell'articolo 1012)). Sono altresi' a carico dell'assicuratore le spese incontrate dall'esercente per resistere, con il consenso dell'assicuratore stesso, alle pretese del terzo. 
codice della navigazione	Art. 1018. (Danni a terzi sulla superficie in seguito ad urto). Nei casi previsti dall'articolo precedente, l'assicuratore non risponde dei danni arrecati dall'aeromobile a terzi sulla superficie. 
codice della navigazione	Art. 1019. (Durata del rischio). Il rischio comincia dall'inizio delle manovre per l'involo e finisce al termine di quelle di approdo. Disposizioni comuni 
codice della navigazione	Art. 1020. (Prescrizione). Alla prescrizione dei diritti derivanti dal contratto di assicurazione si applicano le disposizioni dell'articolo 547. ((Il diritto di risarcimento per danni subiti dal terzo sulla superficie si prescrive nello stesso termine in cui si prescrive il diritto al risarcimento del danneggiato contro l'esercente.)) 
codice della navigazione	Art. 1021. (Rinvio). Alle assicurazioni contro i rischi della navigazione aerea si applicano, per quanto non e' disposto dal presente titolo, le disposizioni del titolo delle assicurazioni della parte prima, ad eccezione degli articoli 515 secondo comma, 527, 538. TITOLO QUINTO Dei privilegi 
codice della navigazione	Art. 1022. (Preferenza dei privilegi). I privilegi stabiliti nel presente capo sono preferiti ad ogni altro privilegio generale o speciale. 
codice della navigazione	Art. 1023. (Privilegi sull'aeromobile e sul nolo). Sono privilegiati sull'aeromobile, sul nolo del viaggio durante il quale e' sorto il credito, sulle pertinenze e sulle parti separabili dell'aeromobile nei limiti fissati nell'articolo 1029, e sugli accessori del nolo guadagnati dopo l'inizio del viaggio: 1 le spese giudiziali dovute allo Stato o fatte nell'interesse comune dei creditori per atti conservativi sull'aeromobile o per il processo di esecuzione; i diritti di aeroporto, gli altri diritti e le tasse della medesima specie; le spese di custodia e di conservazione dell'aeromobile dopo l'arrivo nel luogo di ultimo approdo; 2 i crediti derivanti dal contratto di lavoro del personale di volo; 3 i crediti per le somme anticipate dall'amministrazione aeronautica o dall'autorita' consolare per il mantenimento e il rimpatrio dei componenti dell'equipaggio; i crediti per contributi obbligatori dovuti ad istituti di previdenza e di assistenza sociale per il personale di volo; 4 le indennita' e i compensi di assistenza e di salvataggio; 5 le indennita' per danni a terzi sulla superficie, quando l'esercente non abbia contratta o mantenuta in vigore l'assicurazione obbligatoria; le indennita' per l'urto di aeromobile previsto ((negli articoli 966 e 967)); le indennita' per morte e per lesioni personali ai passeggeri ed agli equipaggi e quelle per perdita o avarie del carico o del bagaglio; 6 i crediti derivanti da contratti stipulati o da operazioni eseguite, in virtu' dei suoi poteri legali, dal comandante, anche quando sia esercente dell'aeromobile, per le esigenze della conservazione dell'aeromobile ovvero della continuazione del viaggio. 
codice della navigazione	Art. 1024. (Privilegi sulle cose caricate). Sono privilegiati sulle cose caricate: 1 le spese giudiziali dovute allo Stato o fatte nell'interesse comune dei creditori per atti conservativi sulle cose o per il processo di esecuzione; 2 i diritti doganali dovuti sulle cose nel luogo di consegna; 3 le indennita' ed i compensi per assistenza e salvataggio; 4 i crediti derivanti dal contratto di trasporto, comprese le spese di scaricazione ed il fitto dei magazzini nei quali le cose scaricate sono depositate. 
codice della navigazione	Art. 1025. (Estinzione dei privilegi sull'aeromobile e sul nolo). I privilegi sull'aeromobile e sul nolo si estinguono, oltre che per l'estinzione del credito, con lo spirare del termine di novanta giorni. 
codice della navigazione	Art. 1026. (Rinvio). Per quanto non e' disposto in questo capo si applicano le disposizioni degli articoli 549 a 551; 553 a 555; 556 primo, secondo, quarto e quinto comma, 557 a 560; 562 a 564. Dell'ipoteca 
codice della navigazione	Art. 1027. (Concessione d'ipoteca su aeromobile). Sull'aeromobile puo' solo concedersi ipoteca volontaria. La concessione d'ipoteca deve farsi, sotto pena di nullita', per atto pubblico o per scrittura privata, contenente la specifica indicazione degli elementi d'individuazione dell'aeromobile. 
codice della navigazione	Art. 1028. (Ipoteca su aeromobile in costruzione). L'ipoteca puo' essere concessa anche su aeromobile in costruzione. Essa puo' essere validamente trascritta dal momento in cui e' presa nota della costruzione nel registro delle costruzioni. 
codice della navigazione	Art. 1029. (Oggetto dell'ipoteca). L'ipoteca ha per oggetto l'aeromobile, le sue pertinenze e parti separabili anche se separate, tranne quelle che risultano appartenere a persona diversa dal proprietario dell'aeromobile, da scrittura avente data certa o dal certificato di immatricolazione dell'aeromobile. 
codice della navigazione	Art. 1030. (Pubblicita' dell'ipoteca). Per gli effetti previsti dal codice civile, l'ipoteca sull'aeromobile deve essere resa pubblica, mediante trascrizione nel registro aeronautico nazionale e annotazione sul certificato di immatricolazione ((. . .)). L'ipoteca su aeromobile in costruzione e' resa pubblica mediante trascrizione nel registro delle costruzioni. Nelle stesse forme devono essere resi pubblici gli altri atti per i quali il codice civile richiede l'iscrizione. 
codice della navigazione	Art. 1031. (Ufficio competente). La pubblicita' deve essere richiesta all'ufficio di iscrizione dell'aesomobile. Tuttavia la pubblicita' puo' richiedersi anche alle autorita' indicate ((nell'articolo 866)). 
codice della navigazione	Art. 1032. (Documenti per la pubblicita' dell'ipoteca). Chi domanda la pubblicita' dell'ipoteca deve consegnare all'ufficio competente i documenti indicati nell'articolo 569. Se la richiesta di pubblicita' si riferisce ad un aeromobile munito di certificato d'immatricolazione, il richiedente deve esibire all'ufficio il certificato medesimo, perche' su questo sia eseguita la prescritta annotazione. Nel caso che la pubblicita' venga richiesta al ministero per l'aeronautica e tale esibizione non sia possibile perche' l'aeromobile si trova altrove, si applica il disposto del secondo comma dell'articolo 869. 
codice della navigazione	Art. 1033. (Esecuzione della pubblicita'). La pubblicita' si esegue dall'ufficio nei modi previsti nell'articolo 870. 
codice della navigazione	Art. 1034. (Ordine di precedenza e prevalenza delle trascrizioni). Nel concorso di piu' atti resi pubblici a norma degli articoli precedenti, nonche' in caso di discordanza tra le trascrizioni nel registro e le annotazioni sul certificato d'immatricolazione, si applica il disposto dell'articolo 871. 
codice della navigazione	Art. 1035. (Grado dell'ipoteca). L'ipoteca prende grado dal momento della trascrizione nel registro d'immatricolazione ((. . .)) dell'aeromobile. 
codice della navigazione	Art. 1036. (Graduazione dell'ipoteca nel concorso con i privilegi). L'ipoteca prende grado dopo i privilegi indicati dall'articolo 1023 ed e' preferita ad ogni altro privilegio generale o speciale. 
codice della navigazione	Art. 1037. (Rinvio). Per quanto non e' disposto in questo capo, si applicano gli articoli 572, 573, 576, 577. TITOLO PRIMO 
codice della navigazione	Art. 1038. (Domanda di indennita' per assistenza o salvataggio). La domanda di indennita' o di compenso per assistenza o salvataggio puo' proporsi anche avanti il giudice, che ha autorizzato il sequestro dell'aeromobile o del carico, nei limiti della competenza per valore. 
codice della navigazione	Art. 1039. (Domanda per danni a terzi sulla supeficie o per danni da urto). La domanda di risarcimento per danni a terzi sulla superficie o per danni da urto puo' proporsi anche avanti il giudice che ha autorizzato il sequestro dell'aeromobile o del carico, nei limiti della competenza per valore. 
codice della navigazione	Art. 1040. (Spostamento di competenza per ragione di connessione). Se sono proposte contro il vettore, l'esercente o l'assicuratore avanti giudici diversi piu' cause dipendenti dallo stesso contratto di trasporto, ovvero dallo stesso fatto di assistenza o, infine, dallo stesso urto di aeromobili ovvero dallo stesso evento produttivo di danni a'terzi sulla superficie, il giudice fissa con sentenza alle parti un termine perentorio per la riassunzione della causa avanti il giudice adito, nella circoscrizione del quale e' il foro generale del convenuto, o, in difetto, avanti quello per primo adito. Si applica il secondo comma dell'articolo 40 del codice di procedura civile. 
codice della navigazione	Art. 1041 (Giudice competente). Il procedimento di limitazione e' promosso avanti il tribunale della circoscrizione nella quale e' il foro generale dell'istante. 
codice della navigazione	Art. 1042. (Legittimazione alla domanda). La domanda di apertura del procedimento di limitazione puo' essere proposta dall'esercente e, se trattasi di debiti per danni arrecati a terzi sulla superficie, anche dall'assicuratore. 
codice della navigazione	Art. 1043. (Domanda di apertura). La domanda di apertura si propone con ricorso al tribunale, competente ai sensi dell'articolo 1041. Il ricorso deve indicare il nome, la paternita', la nazionalita' e il domicilio dell'istante; la dichiarazione di residenza e l'elezione di domicilio dell'istante stesso nel comune, in cui ha sede il giudice competente; gli elementi di individuazione dell'aeromobile e il luogo in cui si trova; l'accidente al quale le obbligazioni si riferiscono. Insieme con il ricorso, l'istante deve depositare, a pena di inammissibilita', nella cancelleria del tribunale: a) il certificato di navigabilita' o di collaudo ovvero copia in forma autentica di essi; b) l'elenco nominativo dei creditori soggetti alla limitazione, con l'indicazione del loro domicilio, del titolo e dell'ammontare del credito di ciascuno; c) il certificato delle ipoteche trascritte sull'aeromobile; d) la nota vistata dal ministro per l'aeronautica ovvero la polizza di assicurazione, se trattasi di debiti per danni arrecati a terzi sulla superficie. 
codice della navigazione	Art. 1044. (Sentenza di apertura). Con sentenza esecutiva, il tribunale, accertata, in seguito alla domanda dell'esercente o dell'assicuratore, l'esistenza degli estremi di legge, dichiara aperto il procedimento di limitazione. Con la stessa sentenza il tribunale designa un giudice per la formazione dello stato attivo e passivo, per il riparto della somma e per l'istruzione dei processi di opposizione alla sentenza di apertura e alla formazione dello stato passivo e dello stato di riparto; stabilisce entro dieci giorni dalla data di pubblicazione della sentenza la data di deposito dello stato attivo; assegna ai creditori per la presentazione in cancelleria delle domando e dei titoli un termine non superiore a giorni trenta dalla data di pubblicazione della sentenza, o a sessanta per i creditori residenti all'estero; stabilisce, entro sessanta giorni dalla decorrenza del maggior termine fissato per la presentazione delle domande e dei titoli dei creditori, la data di deposito dello stato passivo; fissa, non prima di dieci e non oltre venti giorni da quest'ultima data, l'udienza di trattazione delle impugnazioni dello stato passivo avanti il collegio. 
codice della navigazione	Art. 1045. (Notifica e pubblicazione della sentenza di apertura). La sentenza, a cura della cancelleria, e' portata a conoscenza dell'istante e dei creditori indicati nello elenco di cui all'articolo 1043, mediante lettera raccomandata con avviso di ricevimento. La sentenza stessa, a cura della cancelleria, e' altresi' trasmessa in estratto all'ufficio di iscrizione dell'aeromobile, e, parimenti in estratto, pubblicata nella Gazzetta Ufficiale del Regno. L'ufficio di iscrizione, avuta conoscenza della sentenza, ne fa annotazione nel registro di iscrizione dell'aeromobile, e ne cura l'affissione nell'albo dell'ufficio stesso. 
codice della navigazione	Art. 1046. (Effetti dell'apertura del procedimento). L'apertura del procedimento produce gli effetti indicati negli articoli 625, 626. 
codice della navigazione	Art. 1047. (Opposizione dei creditori). Contro la sentenza di apertura, i creditori possono promuovere opposizione, entro quindici giorni dalla avvenuta pubblicazione nella Gazzetta Ufficiale, per l'inesistenza degli estremi di legge, in contraddittorio dell'istante. L'opposizione produce gli effetti indicati nel secondo comma dell'articolo 627. 
codice della navigazione	Art. 1048. (Formazione dello stato attivo). Nel termine fissato dalla sentenza di apertura, il giudice designato, sentiti l'istante e i creditori concorrenti, forma' lo stato attivo ((. . .)). L'avvenuto deposito dello stato attivo e' comunicato all'istante e ai creditori mediante lettera raccomandata con avvito di ricevimento. 
codice della navigazione	Art. 1049. (Deposito della somma limite). Entro tre giorni dalla formazione dello stato attivo il giudice designato fissa il termine, non superiore a cinque giorni, e le modalita' per il deposito della somma limite computata sulla base dello stato attivo e di una congrua somma per le spese del procedimento. Il provvedimento del giudice e' comunicato all'istante e ai creditori nei modi stabiliti dall'articolo precedente. 
codice della navigazione	Art. 1050. (Formazione dello stato passivo e di riparto). La formazione dello stato passivo e dello stato di riparto e le relative impugnazioni sono regolate dalle disposizioni degli articoli 634 a 638. 
codice della navigazione	Art. 1051. (Fallimento dell'esercente). Gli effetti del fallimento dell'esercente, dichiarato successivamente al deposito della somma limite, sono regolati dalle disposizioni dell'articolo 639. 
codice della navigazione	Art. 1052 (Decadenza dell'esercente dal beneficio della limitazione). L'esercente decade dal beneficio della limitazione per mancato deposito, entro il termine fissato, della somma limite o della somma per le spese del procedimento. 
codice della navigazione	Art. 1053. (Dichiarazione di estinzione del procedimento. In caso di fallimento dell'esercente, dichiarato anteriormente al deposito della somma limite, e nel caso di decadenza prevista dall'articolo precedente si applica la disposizione dell'articolo 641. 
codice della navigazione	Art. 1054. (Comunicazioni all'esercente). Quando il procedimento e' promosso dall'assicuratore, gli atti si compiono anche nei confronti dell'esercente, il quale deve essere sentito ogni qualvolta, a norma delle disposizioni del presente titolo, deve essere sentito l'istante. Disposizioni generali 
codice della navigazione	Art. 1055. (Competenza). L'esecuzione forzata e' promossa avanti il pretore nella circoscrizione del quale si trova l'aeromobile. Il sequestro conservativo e giudiziario e' autorizzato dai giudici competenti a norma del codice di procedura civile. 
codice della navigazione	Art. 1056. (Oggetto dell'espropriazione e delle misure cautelari). Salve le eccezioni contemplate nell'articolo seguente, possono formare oggetto di espropriazione forzata e di misure cautelari gli aeromobili, le loro quote, le parti separabili e le pertinenze. Se oggetto di espropriazione forzata e di misure cautelari sono quote di comproprieta' dell'aeromobile, il pretore puo', sentiti i comproprietari non debitori, autorizzare il pignoramento o il sequestro dell'intero aeromobile, quando il debitore sia comproprietario per piu' della meta' del valore dell'aeromobile; in tal caso, il diritto spettante ai comproprietari non debitori sulle quote ad essi appartenenti e' convertito nel diritto alla corrispondente parte del prezzo di aggiudicazione ed e' esente da ogni concorso alle spese delle procedure esecutive e cautelari. 
codice della navigazione	Art. 1057. (Aeromobile non soggetti a pignoramento e a sequestro). Non possono formare oggetto di espropriazione forzata ne' di misure cautelari: a) gli aeromobili di Stato; b) gli aeromobili effettivamente in servizio su di una linea di trasporti aerei e gli aeromobili di riserva, se non sia intervenuta l'autorizzazione del ministro limitazione per l'aeronautica; c) gli aeromobili' addetti al trasporto per scopo di della lucro di persone o di cose, pronti a partire o in corso di navigazione, purche' non si tratti di debiti a causa del viaggio che stanno per intraprendere o che proseguono. L'aeromobile si reputo pronto a partire quando il comandante ha ricevuto l'autorizzazione di cui all'art. 802. 
codice della navigazione	Art. 1058. (Provvedimenti per impedire la partenza dell'aeromobile). Il giudice competente a sensi dell'articolo 1055 e, ove ne ricorra l'urgenza, il ((ENAC)) e l'autorita' di polizia giudiziaria del luogo nel quale si trova l'aeromobile, possono prendere i provvedimenti opportuni per impedire la partenza dell'aeromobile. 
codice della navigazione	Art. 1059. (Forma e notificazione del precetto). Il precetto e' formato e notificato a norma degli articoli 647, 648, primo comma; esso diviene inefficace, trascorsi trenta giorni senza che si sia proceduto al pignoramento. Del procedimento di espropriazione forzata 
codice della navigazione	Art. 1060. (Giudice dell'esecuzione). L'espropriazione e' diretta da un giudice. Nei procedimenti avanti le preture, delle quali fanno parte piu' magistrati, la nomina del giudice dell'esecuzione e' fatta dal pretore dirigente, su presentazione, a cura del cancelliere, del fascicolo di cui al terzo comma dell'articolo 1064, entro due giorni da che e' stato formato. 
