codice della navigazione	Art. 1. E' approvato il testo definitivo del Codice della navigazione, il quale avra' esecuzione a cominciare dal 21 aprile 1942-XX, sostituendo da questa data il testo emanato col R. decreto 17 gennaio 1941-XIX, n. 9. 
codice della navigazione	Art. 2. Un esemplare del testo del Codice della navigazione, firmato da Noi e contrassegnato dal Nostro Ministro Segretario di Stato per la grazia e giustizia, servira' di originale e sara' depositato e custodito nello Archivio del Regno. Ordiniamo che il presente decreto, munito del sigillo dello Stato, sia inserto nella Raccolta ufficiale delle leggi e dei decreti del Regno d'Italia, mandando a chiunque spetti di osservarlo e di farlo osservare. Dato a Roma, addi' 30 marzo 1942-XX VITTORIO EMANUELE Mussolini - Grandi Visto, il Guardasigilli: Grandi Registrato alla Corte dei conti, addi' 17 aprile 1942-XX Atti del Governo, registro 444, foglio 50. - Mancini CODICE DELLA NAVIGAZIONE 
codice della navigazione	Art. 1. (Fonti del diritto della navigazione). In materia di navigazione, marittima, interna ed aerea, si applicano il presente codice, le leggi, i regolamenti, le norme corporative e gli usi ad essa relativi. Ove manchino disposizioni del diritto della navigazione e non ve ne siano di applicabili per analogia, si applica il diritto civile. 
codice della navigazione	Art. 2. ((Mare territoriale.)) ((Sono soggetti alla sovranita' dello Stato i golfi, i seni e le baie, le cui coste fanno parte del territorio della Repubblica, quando la distanza fra i punti estremi dell'apertura del golfo, del seno o della baia non supera le ventiquattro miglia marine. Se tale distanza e' superiore a ventiquattro miglia marine, e' soggetta alla sovranita' dello Stato la porzione del golfo, del seno o della baia compresa entro la linea retta tirata tra i due punti piu' foranei distanti tra loro ventiquattro miglia marine. E' soggetta altresi' alla sovranita' dello Stato la zona di mare dell'estensione di dodici miglia marine lungo le coste continentali ed insulari della Repubblica e lungo le linee rette congiungenti i punti estremi indicati nel comma precedente. Tale estensione si misura dalla linea costiera segnata dalla bassa marea. Sono salve le diverse disposizioni che siano stabilite per determinati effetti da leggi o regolamenti ovvero da convenzioni internazionali)). 
codice della navigazione	Art. 3. (Spazio aereo soggetto alla sovranita' dello Stato). E' soggetto alla sovranita' dello Stato lo spazio aereo che sovrasta il territorio del Regno ed il relativo mare territoriale. 
codice della navigazione	Art. 4. (Navi e aeromobili italiani in localita' non soggette alla sovranita' di alcuno stato). Le navi italiane in alto mare e gli aeromobili italiani in luogo o spazio non soggetto alla sovranita' di alcuno Stato sono considerati come territorio italiano. ((43))   Il D.P.R. 21 febbraio 1990, n. 66 ha disposto (con l'art. 8, comma 1, lettera a)) che durante il periodo di temporanea abilitazione alla navigazione ed all'uso della bandiera italiana la nave e' considerata italiana ai fini di cui al presente articolo. Ha inoltre disposto (con l'art. 14, comma 1, lettera a)) che durante il periodo di sospensione temporanea dell'abilitazione alla navigazione ed all'uso della bandiera la nave non e' considerata italiana ai fini di cui al presente articolo. 
codice della navigazione	Art. 5. (Legge regolatrice degli atti compiuti a bordo di navi e di aeromobili in navigazione). Gli atti ed i fatti compiuti a bordo di una nave o di un aeromobile nel corso della navigazione in luogo o spazio soggetto alla sovranita' di uno Stato estero sono regolati dalla legge nazionale della nave o dell'aeromobile in tutti i casi nei quali, secondo le disposizioni sull'applicazione delle leggi in generale, dovrebbe applicarsi la legge del luogo dove l'atto e' compiuto o il fatto e' avvenuto. La disposizione del comma precedente si applica agli atti ed ai fatti compiuti a bordo di una nave o di un aeromobile di nazionalita' estera nel corso della navigazione in luogo o spazio soggetto alla sovranita' dello Stato italiano, sotto condizione di reciprocita' da parte dello Stato al quale la nave o l'aeromobile appartiene. ((43))   Il D.P.R. 21 febbraio 1990, n. 66 ha disposto (con l'art. 8, comma 1, lettera b)) che durante il periodo di temporanea abilitazione alla navigazione ed all'uso della bandiera italiana si intende per "legge nazionale della nave" quella italiana ai fini di cui al presente articolo. Ha inoltre disposto (con l'art. 14, comma 1, lettera b)) che durante il periodo di sospensione temporanea dell'abilitazione alla navigazione ed all'uso della bandiera fatte salve le disposizioni di cui all'art. 29, commi 2 e 3, della legge 14 giugno 1989, n. 234, in materia di lavoro marittimo, ai fini di cui al presente articolo, si intende per "legge nazionale della nave" quella dello Stato straniero nei cui appositi registri la nave e' iscritta. 
codice della navigazione	Art. 6. (Legge regolatrice dei diritti reali e di garanzia su navi ed aeromobili). La proprieta', gli altri diritti reali e i diritti di garanzia sulle navi e sugli aeromobili, nonche' le forme di pubblicita' degli atti di costituzione, trasmissione ed estinzione di tali diritti, sono regolati dalla legge nazionale della nave o dell'aeromobile. ((43))   Il D.P.R. 21 febbraio 1990, n. 66 ha disposto (con l'art. 8, comma 1, lettera c)) che durante il periodo di temporanea abilitazione alla navigazione ed all'uso della bandiera italiana si intende per "legge nazionale della nave" quella dello Stato responsabile del registro sottostante ai fini di cui al presente articolo. Ha inoltre disposto (con l'art. 14, comma 1, lettera c)) che durante il periodo di sospensione temporanea dell'abilitazione alla navigazione ed all'uso della bandiera si intende per "legge nazionale della nave" quella italiana ai fini di cui al presente articolo. 
codice della navigazione	Art. 7. (Legge regolatrice della responsabilita' dell'armatore e dell'esercente). La responsabilita' dell'armatore della nave o dello esercente dell'aeromobile per atti o fatti dell'equipaggio e' regolata dalla legge nazionale della nave o dell'aeromobile. La stessa legge regola i limiti legali del debito complessivo o della responsabilita' dell'armatore o dell'esercente anche per le obbligazioni da loro personalmente assunte. ((43))   Il D.P.R. 21 febbraio 1990, n. 66 ha disposto (con l'art. 8, comma 1, lettera b)) che durante il periodo di temporanea abilitazione alla navigazione ed all'uso della bandiera italiana si intende per "legge nazionale della nave" quella italiana ai fini di cui al presente articolo. Ha inoltre disposto (con l'art. 14, comma 1, lettera b)) che durante il periodo di sospensione temporanea dell'abilitazione alla navigazione ed all'uso della bandiera fatte salve le disposizioni di cui all'art. 29, commi 2 e 3, della legge 14 giugno 1989, n. 234, in materia di lavoro marittimo, ai fini di cui al presente articolo, si intende per "legge nazionale della nave" quella dello Stato straniero nei cui appositi registri la nave e' iscritta. 
codice della navigazione	Art. 8 (Legge regolatrice dei poteri e dei doveri del comandante). I poteri, i doveri e le attribuzioni del comandante della nave o dell'aeromobile sono regolati dalla legge nazionale della nave o dell'aeromobile. ((43))   Il D.P.R. 21 febbraio 1990, n. 66 ha disposto (con l'art. 8, comma 1, lettera b)) che durante il periodo di temporanea abilitazione alla navigazione ed all'uso della bandiera italiana si intende per "legge nazionale della nave" quella italiana ai fini di cui al presente articolo. Ha inoltre disposto (con l'art. 14, comma 1, lettera b)) che durante il periodo di sospensione temporanea dell'abilitazione alla navigazione ed all'uso della bandiera fatte salve le disposizioni di cui all'art. 29, commi 2 e 3, della legge 14 giugno 1989, n. 234, in materia di lavoro marittimo, ai fini di cui al presente articolo, si intende per "legge nazionale della nave" quella dello Stato straniero nei cui appositi registri la nave e' iscritta. 
codice della navigazione	Art. 9. (Legge regolatrice del contratto di lavoro). I contratti di lavoro della gente del mare, del personale navigante della navigazione interna e del personale di volo sono regolati dalla legge nazionale della nave o dell'aeromobile, salva, se la nave o l'aeromobile e' di nazionalita' straniera, la diversa volonta' delle parti. ((43))   Il D.P.R. 21 febbraio 1990, n. 66 ha disposto (con l'art. 8, comma 1, lettera b)) che durante il periodo di temporanea abilitazione alla navigazione ed all'uso della bandiera italiana si intende per "legge nazionale della nave" quella italiana ai fini di cui al presente articolo. Ha inoltre disposto (con l'art. 14, comma 1, lettera b)) che durante il periodo di sospensione temporanea dell'abilitazione alla navigazione ed all'uso della bandiera fatte salve le disposizioni di cui all'art. 29, commi 2 e 3, della legge 14 giugno 1989, n. 234, in materia di lavoro marittimo, ai fini di cui al presente articolo, si intende per "legge nazionale della nave" quella dello Stato straniero nei cui appositi registri la nave e' iscritta. 
codice della navigazione	Art. 10. (Legge regolatrice dei contratti di utilizzazione di navi e aeromobili). I contratti di locazione, di noleggio, di trasporto sono regolati dalla legge nazionale della nave o dell'aeromobile, salva la diversa volonta' delle parti. ((43))   Il D.P.R. 21 febbraio 1990, n. 66 ha disposto (con l'art. 8, comma 1, lettera b)) che durante il periodo di temporanea abilitazione alla navigazione ed all'uso della bandiera italiana si intende per "legge nazionale della nave" quella italiana ai fini di cui al presente articolo. Ha inoltre disposto (con l'art. 14, comma 1, lettera b)) che durante il periodo di sospensione temporanea dell'abilitazione alla navigazione ed all'uso della bandiera fatte salve le disposizioni di cui all'art. 29, commi 2 e 3, della legge 14 giugno 1989, n. 234, in materia di lavoro marittimo, ai fini di cui al presente articolo, si intende per "legge nazionale della nave" quella dello Stato straniero nei cui appositi registri la nave e' iscritta. 
codice della navigazione	Art. 11. (Legge regolatrice della contribuzione alle avarie comuni). La contribuzione alle avarie comuni e' regolata dalla legge nazionale della nave o dell'aeromobile. ((43))   Il D.P.R. 21 febbraio 1990, n. 66 ha disposto (con l'art. 8, comma 1, lettera b)) che durante il periodo di temporanea abilitazione alla navigazione ed all'uso della bandiera italiana si intende per "legge nazionale della nave" quella italiana ai fini di cui al presente articolo. Ha inoltre disposto (con l'art. 14, comma 1, lettera b)) che durante il periodo di sospensione temporanea dell'abilitazione alla navigazione ed all'uso della bandiera fatte salve le disposizioni di cui all'art. 29, commi 2 e 3, della legge 14 giugno 1989, n. 234, in materia di lavoro marittimo, ai fini di cui al presente articolo, si intende per "legge nazionale della nave" quella dello Stato straniero nei cui appositi registri la nave e' iscritta. 
codice della navigazione	Art. 12. (Legge regolatrice delle obbligazioni derivanti da urto di navi o aeromobili). Le obbligazioni derivanti da urto di navi o di aeromobili in alto mare o in altro luogo o spazio non soggetto alla sovranita' di alcuno Stato sono regolate dalla legge nazionale delle navi o degli aeromobili, se e' comune; altrimenti dalla legge italiana. ((43))   Il D.P.R. 21 febbraio 1990, n. 66 ha disposto (con l'art. 8, comma 1, lettera b)) che durante il periodo di temporanea abilitazione alla navigazione ed all'uso della bandiera italiana si intende per "legge nazionale della nave" quella italiana ai fini di cui al presente articolo. Ha inoltre disposto (con l'art. 14, comma 1, lettera b)) che durante il periodo di sospensione temporanea dell'abilitazione alla navigazione ed all'uso della bandiera fatte salve le disposizioni di cui all'art. 29, commi 2 e 3, della legge 14 giugno 1989, n. 234, in materia di lavoro marittimo, ai fini di cui al presente articolo, si intende per "legge nazionale della nave" quella dello Stato straniero nei cui appositi registri la nave e' iscritta. 
codice della navigazione	Art. 13. (Legge regolatrice delle obbligazioni derivanti da assistenza, salvataggio e ricupero). Le obbligazioni derivanti da assistenza, salvataggio e ricupero compiuti in alto mare sono regolate dalla legge nazionale della nave o dell'aeromobile che ha prestato il soccorso o compiuto il ricupero. La stessa legge regola la ripartizione del compenso per assistenza, salvataggio e ricupero fra l'armatore a l'esercente e l'equipaggio. ((43))   Il D.P.R. 21 febbraio 1990, n. 66 ha disposto (con l'art. 8, comma 1, lettera b)) che durante il periodo di temporanea abilitazione alla navigazione ed all'uso della bandiera italiana si intende per "legge nazionale della nave" quella italiana ai fini di cui al presente articolo. Ha inoltre disposto (con l'art. 14, comma 1, lettera b)) che durante il periodo di sospensione temporanea dell'abilitazione alla navigazione ed all'uso della bandiera fatte salve le disposizioni di cui all'art. 29, commi 2 e 3, della legge 14 giugno 1989, n. 234, in materia di lavoro marittimo, ai fini di cui al presente articolo, si intende per "legge nazionale della nave" quella dello Stato straniero nei cui appositi registri la nave e' iscritta. 
codice della navigazione	Art. 14. (Competenza giurisdizionale). Oltre che nei casi previsti dall'articolo 4 del codice di procedura civile, le domande riguardanti urto di navi o di aeromobili ovvero assistenza, salvataggio o ricupero in alto mare o in altro luogo o spazio non soggetto alla sovranita' di alcuno Stato possono proporsi avanti i giudici del Regno, se la nave o l'aeromobile che ha cagionato l'urto o che e' stato assistito o salvato, ovvero le persone salvate o le cose salvate o ricuperate si trovano nel Regno. Dell'amministrazione della navigazione marittima 
codice della navigazione	Art. 15. (Ministro competente). L'amministrazione della marina mercantile e' retta dal ministro per le comunicazioni. 
codice della navigazione	Art. 16. (Circoscrizioni del litorale del Regno). Il litorale del Regno e' diviso in zone marittime; le zone sono suddivise in compartimenti e questi in circondari. Alla zona e preposto un direttore marittimo, al compartimento un capo del compartimento, al circondario un capo del circondario. Nell'ambito del compartimento in cui ha sede l'ufficio della direzione marittima, il direttore marittimo e' anche capo del compartimento. Nell'ambito del circondario in cui ha sede l'ufficio del compartimento, il capo del compartimento e' anche capo del circondario. Negli approdi di maggiore importanza in cui non hanno sede ne' l'ufficio del compartimento ne' l'ufficio del circondario sono istituiti uffici locali di porto o delegazioni di spiaggia, dipendenti dall'ufficio circondariale. Il capo del compartimento, il capo del circondario e i capi degli altri uffici marittimi dipendenti sono comandanti del porto o dell'approdo in cui hanno sede. 
codice della navigazione	Art. 17. (Attribuzioni degli uffici locali). Il direttore marittimo esercita le attribuzioni conferitegli dal presente codice, dalle altre leggi e dai regolamenti. Il capo del compartimento, il capo del circondario e i capi degli altri uffici marittimi dipendenti, oltre le attribuzioni conferite a ciascuno di essi dal presente codice, dalle altre leggi e dai regolamenti, esercitano, nell'ambito delle rispettive circoscrizioni, tutte le attribuzioni amministrative relative alla navigazione e al traffico marittimo, che non siano specificamente conferite a determinate autorita'. 
codice della navigazione	Art. 18. (Personale dell'amministrazione marittima). Le funzioni amministrative attinenti alla navigazione e al traffico marittimo sono esercitate dal corpo delle capitanerie di porto. Ove se ne riconosca l'opportunita', l'esercizio di tali funzioni puo' essere affidato, nei porti e approdi di minore importanza a persone estranee a detto corpo. 
codice della navigazione	Art. 19. (Enti portuali). Nei porti di maggiore importanza taluni servizi portuali inerenti alla navigazione possono essere affidati ad appositi enti costituiti con legge. 
codice della navigazione	Art. 20 (Vigilanza sulla navigazione e sul traffico all'estero). La vigilanza sulla navigazione e sul traffico marittimo nazionale all'estero e' esercitata dalle autorita' consolari. Dell'amministrazione della navigazione interna 
codice della navigazione	Art. 21. (Ministro competente). L' amministrazione della navigazione su laghi, fiumi, canali e altre acque interne e' retta dal ministro per le comunicazioni. 
codice della navigazione	Art. 22. (Ispettorati compartimentali). Agli effetti dell'ordinamento amministrativo della navigazione interna il territorio del Regno e' diviso in zone. A ciascuna zona e' preposto un ispettorato compartimentale della motorizzazione civile e dei trasporti in concessione. 
codice della navigazione	Art. 23. (Uffici di porto). Nei porti e nelle altre localita' di maggiore importanza per la navigazione interna sono istituiti ispettorati di porto e delegazioni di approdo da questi dipendenti. L'ispettorato di porto esercita sulle vie navigabili comprese nella sua circoscrizione le attribuzioni conferitegli dal presente codice, dalle altre leggi e dai regolamenti. Il capo dell'ispettorato ed il capo della delegazione di approdo sono comandanti del porto ove hanno sede. Nei casi previsti dal regolamento possono essere istituite, fuori della circoscrizione degli ispettorati di porto, delegazioni di approdo direttamente dipendenti dall'ispettorato compartimentale. In tal caso il capo della delegazione esercita anche le attribuzioni del capo dell'ispettorato di porto, conferitegli dal ministro per le comunicazioni. 
codice della navigazione	Art. 24. (Navigazione promiscua). Le navi addette alla navigazione interna, quando entrano in acque marittime, devono osservare le norme di polizia marittima e sono sottoposte alla vigilanza degli organi competenti per la navigazione marittima. Parimenti le navi addette alla navigazione marittima, quando entrano in acque interne, devono osservare le norme di polizia in vigore per tali acque e sono sottoposte alla vigilanza degli organi competenti per la navigazione interna. 
codice della navigazione	Art. 25. (Attribuzioni dell'autorita' comunale). Nelle localita' ove non hanno sede uffici di porto l'esercizio di attribuzioni amministrative relative alla navigazione interna puo' essere conferito a norma del regolamento dal ministro per le comunicazioni all'autorita' comunale. 
codice della navigazione	Art. 26. (Navi e galleggianti addetti al servizio urbano). Nei porti comunicanti con canali ed altre acque interne, il comandante del porto esercita la vigilanza sulle navi e sui galleggianti addetti al servizio urbano che entrano nelle acque marittime. I conflitti di competenza fra l'autorita' marittima e quella comunale relativi al servizio di tali navi e galleggianti sono risolti dal prefetto del luogo ed in via definitiva dal ministro per le comunicazioni. 
codice della navigazione	Art. 27. (Vigilanza sulla navigazione e sul traffico all'estero). La vigilanza sulla navigazione e sul traffico nazionale all'estero e' esercitata dalle autorita' consolari. Del demanio marittimo 
codice della navigazione	Art. 28. (Beni del demanio marittimo). Fanno parte del demanio marittimo: a) il lido, la spiaggia, i porti, le rade; b) le lagune, le foci dei fiumi che sboccano in mare, i bacini di acqua salsa o salmastra che almeno durante una parte dell'anno comunicano liberamente col mare; c) i canali utilizzabili ad uso pubblico marittimo. 
codice della navigazione	Art. 29. (Pertinenze del demanio marittimo). Le costruzioni e le altre opere appartenenti allo Stato, che esistono entro i limiti del demanio marittimo e del mare territoriale, sono considerate come pertinenze del demanio stesso. 
codice della navigazione	Art. 30. (Uso del demanio marittimo). L'amministrazione della marina mercantile regola l'uso del demanio marittimo e vi esercita la polizia. 
codice della navigazione	Art. 31. (Limiti del demanio marittimo). Nei luoghi, nei quali il mare comunica con canali o fiumi o altri corsi di acqua, i limiti del demanio marittimo sono fissati dal ministro per le comunicazioni di concerto con quelli per le finanze e per i lavori pubblici, nonche' con gli altri ministri interessati. 
codice della navigazione	Art. 32. (Delimitazione di zone del demanio marittimo). Il capo del compartimento, quando sia necessario o se comunque ritenga opportuno promuovere la delimitazione di determinate zone del demanio marittimo, invita, nei modi stabiliti dal regolamento, le pubbliche amministrazioni e i privati che possono avervi interesse a presentare le loro deduzioni e ad assistere alle relative operazioni. ((Le contestazioni che sorgono nel corso della delimitazione sono risolte in via amministrativa dal direttore marittimo, di concerto con l'intendente di finanza, con provvedimento definitivo. In caso di accordo di tutte le parti interessate il provvedimento del direttore marittimo da' atto nel relativo processo verbale dell'accordo intervenuto. Negli altri casi il provvedimento deve essere comunicato, con i relativi documenti, al Ministro per la marina mercantile, il quale entro sessanta giorni dalla ricezione puo' annullarlo con suo decreto, da notificarsi, entro i dieci giorni successivi, agli interessati per tramite del direttore marittimo. In caso di annullamento, la risoluzione in via amministrativa della contestazione spetta al Ministro per la marina mercantile, di concerto con quello per le finanze. Nelle controversie innanzi alle autorita' giurisdizionali, la tutela dei beni demaniali spetta esclusivamente al Ministro per le finanze)). 
codice della navigazione	Art. 33. (Ampliamento del demanio marittimo). Quando per necessita' dei pubblici usi del mare occorra comprendere nel demanio marittimo zone di proprieta' privata di limitata estensione e di lieve valore ad esso adiacenti, ovvero i depositi e gli stabilimenti menzionati nell'articolo 52, la dichiarazione di pubblico interesse per l'espropriazione e' fatta con decreto del ministro per le comunicazioni, di concerto con il ministro per le finanze. Il decreto costituisce titolo per l'immediata occupazione del bene da espropriare. 
codice della navigazione	Art. 34. (Destinazione di zone demaniali marittime ad altri usi pubblici). Con provvedimento del ministro per le comunicazioni, su richiesta ((dell'amministrazione statale, regionale o dell'ente locale competente)), determinate parti del demanio marittimo possono essere destinate ad altri usi pubblici, cessati i quali riprendono la loro destinazione normale 
codice della navigazione	Art. 35. (Esclusione di zone dal demanio marittimo). Le zone demaniali che dal capo del compartimento non siano ritenute utilizzabili per pubblici usi del mare sono escluse dal demanio marittimo con decreto del ministro per le comunicazioni di concerto con quello per le finanze. 
codice della navigazione	Art. 36. (Concessione di beni demaniali). L'amministrazione marittima, compatibilmente con le esigenze del pubblico uso, puo' concedere l'occupazione e l'uso, anche esclusivo, di beni demaniali e di zone di mare territoriale per un determinato periodo di tempo. ((Le concessioni di durata superiore a quindici anni sono di competenza del Ministro per la marina mercantile. Le concessioni di durata superiore a quattro, ma non a quindici anni, e quelle di durata non superiore al quadriennio che importino impianti di difficile sgombero sono di competenza del direttore marittimo. Le concessioni di durata non superiore al quadriennio, quando non importino impianti di difficile sgombero, sono di competenza del capo di compartimento marittimo)). ((7))   Il D.P.R. 13 luglio 1954, n. 747 ha disposto (con l'art. 3, comma 5) che la presente modifica ha effetto anche ai fini delle concessioni previste dall'art. 54 del regolamento di esecuzione del Codice della navigazione, approvato con D.P.R. 15 febbraio 1952, n. 328. 
codice della navigazione	Art. 37. (Concorso di piu' domande di concessione). Nel caso di piu' domande di concessione, e' preferito il richiedente che offra maggiori garanzie di proficua utilizzazione della concessione e si proponga di avvalersi di questa per un uso che, a giudizio dell'amministrazione, risponda ad un piu' rilevante interesse pubblico. Al fine della tutela dell'ambiente costiero, per il rilascio di nuove concessioni demaniali marittime per attivita' turistico- ricreative e' data preferenza alle richieste che importino attrezzature non fisse e completamente amovibili. ((PERIODO SOPPRESSO L. 26 FEBBRAIO 2010, N. 25)). Qualora non ricorrano le ragioni di preferenza di cui ai precedenti commi, si procede a licitazione privata. 
codice della navigazione	Art. 38. (Anticipata occupazione di zone demaniali). Qualora ne riconosca l'urgenza, l'autorita' marittima puo', su richiesta dell'interessato, consentire, previa cauzione, l'immediata occupazione e l'uso di beni del demanio marittimo, nonche' l'esecuzione dei lavori all'uopo necessari, a rischio del richiedente, purche' questo si obblighi ad osservare le condizioni che saranno stabilite nell'atto di concessione. Se la concessione e' negata, il richiedente deve demolire le opere eseguite e rimettere i beni nel pristino stato. 
codice della navigazione	Art. 39. (Misura del canone). La misura del canone e' determinata dall'atto di concessione. Nelle concessioni a enti pubblici o privati, per fini di beneficenza o per altri fini di pubblico interesse, sono fissati canoni di mero riconoscimento del carattere demaniale dei beni. 
