codice della navigazione	Art. 306. (Limiti della rappresentanza del comandante). Il comandante puo' in ogni caso provvedere agli approvvigionamenti giornalieri, alle forniture di lieve entita' e alle piccole riparazioni necessarie per la manutenzione ordinaria della nave. Fuori dei luoghi nei quali sono presenti l'armatore o un suo rappresentante munito dei necessari poteri, il comandante puo' compiere gli atti occorrenti per i bisogni della nave e della spedizione; puo' parimenti assumere o congedare componenti dell'equipaggio. La presenza dell'armatore, ovvero quella di un suo rappresentante munito dei necessari poteri, e' opponibile ai terzi solo quando questi ne erano a conoscenza; tuttavia la presenza dell'armatore nel luogo del suo domicilio e la presenza del rappresentante nel luogo relativamente al quale gli sono stati conferiti i poteri debitamente pubblicati si presumono note all'interessato fino a prova contraria. 
codice della navigazione	Art. 307. (Necessita' di denaro in corso di viaggio). Se nel corso del viaggio sorge necessita' di denaro per rifornimento di provviste, per riparazioni o per altra urgente esigenza della nave ovvero per la continuazione del viaggio, che non rientri negli estremi previsti nel primo comma dell'articolo precedente, il comandante deve darne immediato avviso all'armatore. Quando cio' non sia possibile, ovvero se l'armatore debitamente avvertito non abbia fornito i mezzi ne' dato le opportune istruzioni, il comandante, dopo aver accertato la necessita' di provvedere, puo' farsi autorizzare, dalla competente autorita' del luogo, a prendere a prestito la somma necessaria o a contrarre obbligazione verso coloro che somministrano provviste, materiali, attrezzi o mano d'opera, ovvero a dare in pegno o a vendere provviste, attrezzi o arredi della nave non indispensabili alla sicura navigazione. Negli stessi casi il comandante, accertata la necessita' di provvedere, e dato possibilmente tempestivo avviso ai caricatori ed ai destinatari interessati, puo' farsi autorizzare dalla suddetta autorita' a dare in pegno o a vendere le cose caricate; ma gli aventi diritti al carico si possono opporre alla vendita o al pegno delle loro cose, scaricandole a proprie spese e pagando il nolo relativo, in proporzione del tratto utilmente percorso se si valgono tutti della facolta' predetta, o diversamente per intero. Quando la necessita' di procedere al pegno o alla vendita del carico sia determinata dalle esigenze previste dal primo comma dell'articolo precedente, il comandante e' tenuto a dare gli avvisi e a richiedere l'autorizzazione soltanto ove debba ricorrere al pegno o alla vendita del carico. 
codice della navigazione	Art. 308. (Indennizzo degli aventi diritto al carico o dei proprietari delle pertinenze). Quando le merci esistenti a bordo sono impiegate o vendute dal comandante per le esigenze della nave, l'armatore e' tenuto a rimborsare agli aventi diritto il valore che le merci medesime avrebbero avuto al momento dell'arrivo nel luogo di destinazione. Tuttavia, se anteriormente all'arrivo nel luogo di prevista destinazione delle merci impiegate o vendute la nave e' perduta per causa non imputabile all'armatore, questi e' tenuto a corrispondere agli aventi diritto soltanto il valore che le merci avevano al momento dell'impiego ovvero il prezzo ricavato dalla vendita. Quando per le stesse esigenze sono vendute pertinenze di proprieta' aliena, l'armatore e' tenuto a corrispondere ai proprietari il prezzo ricavato dalla vendita o, sempre che la nave non sia andata perduta per causa non imputabile all'armatore, il maggior valore che le pertinenze avevano al momento della vendita. Quando le pertinenze predette o le merci sono date in pegno dal comandante, l'armatore e' tenuto a rimborsare agli aventi diritto la somma necessaria per procedere allo svincolo e al trasporto a destinazione; se tuttavia non e' possibile procedere allo svincolo per causa non imputabile agli aventi diritto, l'armatore e' tenuto a corrispondere il valore delle pertinenze al momento della costituzione del pegno o il valore che le merci avrebbero avuto al momento dell'arrivo nel luogo di destinazione. Nel caso di perdita della nave, prevista nei comma precedenti, l'armatore e' tenuto a corrispondere soltanto una somma pari a quella in garanzia della quale le pertinenze o le merci sono state date in pegno. 
codice della navigazione	Art. 309. (Poteri processuali del comandante). Fuori dei luoghi nei quali sono presenti l'armatore o un suo rappresentante munito dei necessari poteri, il comandante puo', in caso di urgenza, notificare atti ed istituire o proseguire giudizi in nome e nell'interesse dell'armatore, per quanto riguarda la nave e la spedizione. Possono parimenti i terzi, fuori dei luoghi dove sono presenti l'armatore o un suo rappresentante munito dei necessari poteri, fare eseguire notificazioni al comandante personalmente, o contro di questo promuovere o proseguire giudizi, per quanto concerne i fatti dell'equipaggio relativi alla nave e alla spedizione, ovvero le obbligazioni contratte dal comandante durante la spedizione. La presenza dell'armatore o di un suo rappresentante puo' essere opposta ai terzi solo nei casi previsti nel terzo comma dell'articolo 306. L'armatore puo' riassumere le domande proposte dal comandante o contro di lui, e puo' inoltre impugnare le sentenze emesse in contraddittorio del comandante. 
codice della navigazione	Art. 310. (Facolta' di procurarsi denaro in caso di rifiuto dei comproprietari). Se alcuno dei comproprietari che hanno consentito alla costituzione della societa' di armamento rifiuta di contribuire alle spese necessarie per la spedizione, il comandante, ventiquattro ore dopo la intimazione al comproprietario, puo', previa autorizzazione della competente autorita' del luogo, prendere a prestito per conto del comproprietario medesimo la somma da questo dovuta, con garanzia sulla di lui quota di partecipazione nella proprieta' della nave. 
codice della navigazione	Art. 311. (Vendita della nave in caso di innavigabilita'). Il comandante non puo' vendere la nave senza mandato speciale del proprietario. Tuttavia, ove durante il viaggio si verifichi un caso di estrema urgenza, la competente autorita' del luogo, accertata l'assoluta innavigabilita' della nave, puo' autorizzare il comandante a venderla, prescrivendo le modalita' della vendita. 
codice della navigazione	Art. 312. (Gestione di interessi degli aventi diritto al carico). Il comandante deve, quando cio' si renda necessario e compatibilmente con le esigenze della spedizione, provvedere alla tutela degli interessi degli aventi diritto al carico. Se per evitare o diminuire un danno occorrono speciali misure, il comandante deve possibilmente informare gli interessati nel carico, o gli eventuali rappresentanti sul luogo, che siano a lui noti, ed attenersi alle loro istruzioni; in mancanza, deve agire a suo criterio nel modo migliore. 
codice della navigazione	Art. 313. (Responsabilita' del comandante in caso di pilotaggio). In caso di pilotaggio, il comandante e' responsabile dei danni causati alla nave da errata manovra, se non provi che l'errore e' derivato da inesatte indicazioni o informazioni fornite dal pilota. 
codice della navigazione	Art. 314. (Processo verbale). Le cause e la portata dei provvedimenti presi dal comandante ai sensi degli articoli 300 a 302, nonche' la necessita' di provvedere a norma del secondo, terzo e quarto comma dell'articolo 307, devono essere fatte constare, appena possibile, con processo verbale sottoscritto dagli ufficiali di coperta o, in mancanza, dai principali membri dell'equipaggio. In caso di rifiuto di alcuno di costoro a sottoscriverlo, il processo verbale deve indicare le ragioni del rifiuto medesimo. Copia del processo verbale, sottoscritto dal comandante, deve essere allegata alla relazione di eventi straordinari all'atto della prestazione di questa alla competente autorita'. 
codice della navigazione	Art. 315. (Autorita' competente). L'autorita' competente a concedere le autorizzazioni previste in questo capo e a ricevere la relazione di cui all'articolo 304 e', nel Regno, il presidente del tribunale e, fuori del comune ove ha sede il tribunale, il pretore; all'estero, il console o chi ne fa le veci. Dell'equipaggio 
codice della navigazione	Art. 316. (Formazione dell'equipaggio). L'equipaggio della nave marittima e' costituito dal comandante, dagli ufficiali e da tutte le altre persone arruolate per il servizio della nave. L'equipaggio della nave della navigazione interna e' costituito dal comandante, dagli ufficiali e da tutti gli altri iscritti nei registri del personale navigante imbarcati per il servizio della nave. Fa inoltre parte dell'equipaggio il pilota durante il periodo in cui presta servizio a bordo. 
codice della navigazione	Art. 317. (Composizione e forza minima dell'equipaggio). Il comandante del porto provvede all'applicazione delle disposizioni di legge e delle norme corporative riguardanti la determinazione del numero minimo degli ufficiali di coperta e di macchina, e dei relativi gradi, nonche' la composizione e la forza minima dell'intero equipaggio. ((Il Ministro per la marina mercantile, in caso di accertata indisponibilita' di marittimi in possesso dei titoli professionali richiesti dalle norme in vigore, su parere favorevole del comandante del porto, puo' consentire, ai fini della composizione dell'equipaggio delle navi da carico e da pesca, l'imbarco, per un periodo di tempo non superiore a tre mesi, di marittimi muniti dei titolo immediatamente inferiore a quello prescritto)). Le norme relative alla composizione e alla forza minima degli equipaggi delle navi della navigazione interna sono stabilite dal ministro per le comunicazioni. 
codice della navigazione	Art. 318. (Nazionalita' dei componenti dell'equipaggio). 1. L'equipaggio delle navi nazionali armate nei porti della Repubblica deve essere interamente composto da cittadini italiani o di altri Paesi appartenenti all'Unione europea. (63) 2. Alle disposizioni di cui al comma 1 puo' derogarsi attraverso accordi collettivi nazionali stipulati dalle organizzazioni sindacali dei datori di lavoro e dei lavoratori comparativamente piu' rappresentative a livello nazionale. Per i marittimi di nazionalita' diversa da quella italiana o comunitaria, imbarcati in conformita' a quanto previsto dal presente comma, non sono richiesti visto di ingresso nel territorio dello Stato, permesso di soggiorno e autorizzazione al lavoro anche quando la nave navighi nelle acque territoriali o sosti in un porto nazionale. 2-bis. I certificati dei primi ufficiali di coperta non italiani, imbarcati in virtu' degli accordi collettivi nazionali di cui al comma 2, sono soggetti a riconoscimento da parte dell'amministrazione competente, ai sensi dell'articolo 3 del regolamento di cui al decreto del Presidente della Repubblica 9 maggio 2001, n. 324. ((3. Per le navi adibite alla pesca marittima, l'autorita' marittima periferica, delegata dal Ministro delle infrastrutture e dei trasporti, autorizza, previa richiesta dell'armatore, che il personale di bordo sia composto anche da cittadini extracomunitari, tranne che per la qualifica di comandante.))   Il D.L. 30 dicembre 1997, n. 457, convertito con modificazioni dalla L. 27 febbraio 1998, n. 30, come modificato dalla L. 16 marzo 2001, n. 88, ha disposto (con l'art. 2, comma 1-bis) che "In deroga al comma 1 dell'articolo 318 del codice della navigazione, nonche' alle disposizioni di cui al comma 1 del presente articolo, la composizione degli equipaggi delle navi di cui all'articolo 1 puo' essere altresi' determinata in conformita' ad accordi sindacali nazionali stipulati dalle organizzazioni sindacali dei datori di lavoro e dei lavoratori del settore comparativamente piu' rappresentative a livello nazionale". 
codice della navigazione	Art. 319. (Assunzione di personale straniero all'estero). Nei porti esteri della navigazione marittima o interna ((e nei porti nazionali)) ove non siano disponibili rispettivamente marittimi o personale navigante di nazionalita' italiana, possono essere assunti anche stranieri in misura non superiore ad un quarto dell'intero equipaggio e per il solo tempo necessario al viaggio da compiere. In caso di speciali esigenze, l'autorita' consolare ((o la capitaneria di porto)) puo' autorizzare l'assunzione di stranieri in misura superiore a quella indicata nel comma precedente. 
codice della navigazione	Art. 320. (Servizio di macchina). I minori degli anni diciotto non possono essere adibiti al servizio di macchina. 
codice della navigazione	Art. 321. (Gerarchia di bordo delle navi marittime). La gerarchia dei componenti dell'equipaggio marittimo e' la seguente: 1) comandante; 2) direttore di macchina, comandante in seconda, capo commissario, e medico di bordo direttore del servizio sanitario; 3) primo ufficiale di coperta, primo ufficiale di macchina, cappellano, primo medico aggiunto,primo commissario; 4) secondo ufficiale di coperta, secondo ufficiale di macchina, secondo medico aggiunto, secondo commissario, primo radiotelegrafista; 5) gli altri ufficiali; 6) nostromo, maestro di macchina; 7) gli altri sottufficiali; 8) i comuni. Il pilota durante il periodo in cui presta servizio a bordo e' equiparato al primo ufficiale. 
codice della navigazione	Art. 322. (Gerarchia di bordo sulle navi della navigazione interna). La gerarchia dei componenti dell'equipaggio delle navi addette alla navigazione interna e' la seguente: 1) comandante; 2) macchinista, motorista; 3) capo timoniere; 4) i sottufficiali; 5) i comuni. Il pilota durante il periodo in cui presta servizio a bordo e' equiparato al capo timoniere. Della formazione del contratto 
codice della navigazione	Art. 323. (Visita medica). L'arruolamento degli iscritti nelle matricole della gente di mare, destinati a far parte dell'equipaggio, deve, nei casi e con le modalita' prescritte da leggi e regolamenti, essere preceduto da visita medica diretta ad accertare l'idoneita' della persona da arruolare in rapporto al servizio cui deve essere adibita. 
codice della navigazione	Art. 324. (Capacita' dei minori di anni diciotto). Il minore di anni diciotto, iscritto nelle matricole della gente di mare puo', con il consenso di chi esercita la patria potesta' o la tutela, prestare il proprio lavoro, stipulare i relativi contratti ed esercitare i diritti e le azioni che ne derivano. La revoca del consenso alla iscrizione nelle matricole, da parte dell'esercente la patria potesta' o la tutela, fa cessare la capacita' del minore alla stipulazione di contratti di arruolamento, ma non lo priva della capacita' di esercitare i diritti e le azioni che derivano da contratti precedentemente stipulati, ne' della capacita' di prestare, fino al compimento del viaggio in corso, il proprio lavoro in esecuzione del contratto. 
codice della navigazione	Art. 325. (Vari tipi di contratto di arruolamento). Il contratto di arruolamento puo' essere stipulato: a) per un dato viaggio o per piu' viaggi; b) a tempo determinato; c) a tempo indeterminato. La retribuzione spettante all'arruolato puo' essere stabilita: a) in una somma fissa per l'intera durata del viaggio; b) in una somma fissa a mese o ad altro periodo di tempo; c) in forma di partecipazione al nolo o agli altri proventi o prodotti del viaggio, con la fissazione di un minimo garantito; d) parte in forma di somma fissa periodica e parte in forma di partecipazione al nolo o agli altri proventi o prodotti. Agli effetti del contratto di arruolamento, per viaggio si intende il complesso delle traversate fra porto di caricazione e porto di ultima destinazione, oltre all'eventuale traversata in zavorra per raggiungere il porto di caricazione. ((La misura e le componenti della retribuzione sono determinate e regolate dalle norme dei contratti collettivi di lavoro)). 
codice della navigazione	Art. 326. (Durata del contratto a tempo determinato e di quello per piu' viaggi). Il contratto a tempo determinato e quello per piu' viaggi non possono essere stipulati per una durata superiore ad un anno; se sono stipulati per una durata superiore, si considerano a tempo indeterminato. Se, in forza di piu' contratti a viaggio, o di piu' contratti a tempo determinato, ovvero di piu' contratti dell'uno e dell'altro tipo, l'arruolato presta ininterrottamente servizio alle dipendenze dello stesso armatore per un tempo superiore ad un anno, il rapporto di arruolamento e' regolato dalle norme concernenti il contratto a tempo indeterminato. Agli effetti del comma precedente, la prestazione del servizio e' considerata ininterrotta quando fra la cessazione di un contratto e la stipulazione del contratto successivo intercorre un periodo non superiore ai sessanta giorni. 
codice della navigazione	Art. 327. (Arruolamento per nave determinata o per piu' navi dello stesso armatore). Il contratto di arruolamento ha per oggetto la prestazione di servizio su nave determinata. Tuttavia l'arruolato puo', con patto espresso contenuto nel contratto di arruolamento, obbligarsi a prestare servizio su una nave non determinata fra quelle appartenenti all'armatore o su piu' di esse successivamente. 
codice della navigazione	Art. 328. (Forma del contratto). Salvo quanto e' disposto nei successivi articoli, il contratto di arruolamento deve, a pena di nullita', essere fatto per atto pubblico ricevuto, nel Regno, dall'autorita' marittima, e, all'estero, dall'autorita' consolare. Il contratto deve, parimenti a pena di nullita', essere dalle autorita' predette annotato sul ruolo di equipaggio o sulla licenza. Prima della sottoscrizione, il contratto deve essere letto e spiegato al marittimo; l'adempimento di tale formalita' si deve far constare nel contratto stesso. 
codice della navigazione	Art. 329. (Stipulazione del contratto in localita' estera dove non sia autorita' consolare). Se l'arruolamento ha luogo all'estero, in localita' che non e' sede di autorita' consolare, il contratto deve, a pena di nullita', essere stipulato per iscritto, alla presenza di due testimoni, i quali vi appongono la propria sottoscrizione. Il contratto e' conservato fra i documenti di bordo. 
codice della navigazione	Art. 330. (Deroga alle disposizioni precedenti). Il contratto di arruolamento per le navi minori di stazza lorda non superiore alle cinque tonnellate puo' essere fatto verbalmente. Le norme per l'annotazione sulla licenza dei contratti predetti sono stabilite dal regolamento. 
codice della navigazione	Art. 331. (Arruolamento del comandante in luogo ove non si trova l'armatore). L'armatore puo' procedere all'arruolamento del comandante anche mediante dichiarazione, resa al comandante del porto o all'autorita' consolare del luogo dove egli si trova, e contenente gli estremi indicati nell'articolo seguente. La detta autorita' trasmette telegraficamente, a spese dell'armatore, gli estremi della dichiarazione all'autorita' marittima o consolare del porto dove si trova la nave sulla quale il comandante deve prendere imbarco. Con la dichiarazione di accettazione da parte del comandante, resa all'autorita' del porto d'imbarco, si perfeziona il contratto di arruolamento. 
codice della navigazione	Art. 332. (Contenuto del contratto). Il contratto di arruolamento deve enunciare: 1) il nome o il numero della nave sulla quale l'arruolato deve prestare servizio o la clausola prevista nel secondo comma dell'articolo 327; 2) il nome, la paternita' dell'arruolato, l'anno di nascita, il domicilio, l'ufficio di iscrizione e il numero di matricola; 3) la qualifica e le mansioni dell'arruolato; 4) il viaggio o i viaggi da compiere e il giorno in cui l'arruolato deve assumere servizio, se l'arruolamento e' a viaggio; la decorrenza e la durata del contratto, se l'arruolamento e' a tempo determinato; la decorrenza del contratto, se l'arruolamento e' a tempo indeterminato; 5) la forma e la misura della retribuzione; 6) il luogo e la data della conclusione del contratto; 7) l'indicazione del contratto collettivo, qualora esista. Se dal contratto ovvero dall'annotazione sul ruolo di equipaggio o sulla licenza l'arruolamento non risulta stipulato a viaggio o a tempo determinato, esso e' regolato dalle norme concernenti il contratto a tempo indeterminato. Degli effetti del contratto 
codice della navigazione	Art. 333. (Albo a bordo per l'affissione delle disposizioni concernenti il contratto di arruolamento). Su ogni nave nazionale deve essere tenuto, in luogo accessibile all'equipaggio, un albo, nel quale sono affisse le norme di legge e di regolamento relative all'arruolamento, i contratti collettivi di arruolamento, i regolamenti di servizio e ogni altra disposizione di cui venga prescritta l'affissione dall'autorita'. 
codice della navigazione	Art. 334. (Servizio a bordo). I componenti dell'equipaggio non sono tenuti a prestare un servizio diverso da quello per il quale sono stati arruolati. Tuttavia il comandante, nell'interesse della navigazione, ha facolta' di adibire temporaneamente i componenti dell'equipaggio a un servizio diverso da quello per il quale sono stati arruolati, purche' non sia inadeguato al loro titolo professionale e al loro grado. In caso di necessita' per la sicurezza della spedizione, gli arruolati possono essere adibiti a qualsiasi servizio. I componenti dell'equipaggio, che esercitano mansioni diverse da quelle per le quali sono stati arruolati, hanno diritto alla maggiore retribuzione dovuta per tali mansioni. 
codice della navigazione	Art. 335. (Caricazione abusiva di merci). Il comandante e gli altri componenti dell'equipaggio non possono caricare sulla nave merci per proprio conto, senza il consenso scritto dell'armatore o di un suo rappresentante. L'arruolato, che contravviene al divieto del comma precedente, e' tenuto a pagare il nolo in misura doppia di quella corrente nel luogo e alla data della caricazione per il medesimo viaggio e per merce della stessa specie di quella indebitamente imbarcata, senza pregiudizio del risarcimento del danno. 
codice della navigazione	Art. 336. (Trattamento dell'arruolato malato o ferito). L'arruolato che, a bordo, si ammala o riporta lesioni continua a percepire la retribuzione ed ha diritto all'assistenza sanitaria a spese della nave. Se l'arruolato si e' intenzionalmente procurato la malattia o la lesione, ovvero ha contratto la malattia o riportato la lesione per sua grave colpa mentre si trovava a terra senza autorizzazione, l'armatore e' egualmente tenuto a provvedere all'assistenza sanitaria, ma ha diritto di ripeterne le spese dall'arruolato. Nel caso previsto nel comma precedente, il componente dell'equipaggio non ha diritto alla retribuzione per tutto il tempo durante il quale e' inabile al servizio. Se l'arruolato deve essere sbarcato a causa delle sue condizioni di salute o se, per altra ragione, e' sbarcato prima che si sia verificata la guarigione, si applica il disposto degli articoli 356, 365. 
codice della navigazione	Art. 337. (Partecipazione dell'arruolato alle indennita' dovute all'armatore). Se la retribuzione e' determinata in forma di partecipazione al nolo o agli altri proventi o prodotti del viaggio, in caso di perdita del nolo o di detti proventi o prodotti, per la quale sia corrisposta all'armatore una somma a titolo di indennita' di assicurazione o di risarcimento di danni, l'arruolato ha diritto ad una parte di detta somma, nella proporzione stabilita dal contratto. 
codice della navigazione	Art. 338. (Aumento di retribuzione in caso di prolungamento del viaggio). Se la retribuzione e' determinata a viaggio, essa e' proporzionalmente aumentata qualora il viaggio venga protratto oltre la durata massima prevedibile al momento della stipulazione del contratto; ma se l'ulteriore durata e' dovuta a causa non imputabile all'armatore, l'aumento proporzionale e' ridotto a un terzo. La retribuzione non e' soggetta a diminuzione se la nave compie un viaggio piu' breve di quello previsto nel contratto. 
codice della navigazione	Art. 339. (Indennita' per riduzione delle razioni dei viveri). Se la riduzione delle razioni dei viveri, prevista nell'articolo 301, e' dovuta a causa non imputabile all'armatore, questi deve corrispondere ai componenti dell'equipaggio l'equivalente in danaro. Se la riduzione e' determinata da causa a lui imputabile, l'armatore e' tenuto anche al risarcimento dei danni. Della cessazione e della risoluzione del contratto 
codice della navigazione	Art. 340. (Cessazione del contratto a viaggio per compimento del viaggio). Il contratto di arruolamento stipulato per uno o piu' viaggi cessa di diritto con il compimento del viaggio o dell'ultimo dei viaggi previsti nel contratto. 
codice della navigazione	Art. 341. (Cessazione del contratto a tempo determinato per scadenza del termine). Il contratto di arruolamento a tempo determinato cessa di diritto con la scadenza del termine stabilito nel contratto stesso. Tuttavia, se il termine scade in corso di viaggio, il contratto si intende prorogato fino al porto di ultima destinazione. Se il porto di ultima destinazione e' fuori del Regno, e la nave deve intraprendere un altro viaggio direttamente per un porto del Regno, l'arruolato e' tenuto a continuare a prestare la sua opera sulla nave, ma, decorso il periodo determinato dalle norme corporative o, in mancanza, dagli usi, ha diritto ad un aumento di retribuzione nella misura stabilita dalle norme predette, o in mancanza dagli usi, fino a che sia sbarcato nel porto di arruolamento. Se la nave intraprende un altro viaggio per un porto fuori del Regno o non direttamente per un porto del Regno e l'arruolato consente a restare a bordo, l'arruolamento continua alle condizioni stabilite nel contratto, ma l'arruolato ha diritto ad un aumento della retribuzione nella misura fissata secondo il disposto del comma precedente. 
