codice della navigazione	Art. 608. (Giudice di appello). L'appello contro le sentenze pronunciate dal comandante di porto nei processi relativi a controversie previste dall'articolo 603 deve essere proposto avanti la sezione della corte di appello che funziona come magistratura del lavoro, la quale e' integrata da due consiglieri designati dal primo presidente in sostituzione degli esperti. Si applica l'articolo 450, secondo comma del codice di procedura civile. 
codice della navigazione	Art. 609. (Rinvio). Al procedimento per la risoluzione delle controversie contemplate nell'articolo 603 si applicano gli articoli 591 a 598 del presente codice; e gli articoli 439 a 444 del codice di procedura civile. TITOLO TERZO 
codice della navigazione	Art. 610. (Competenza). Se la spedizione o, in caso di viaggio circolare, il viaggio contributivo, ha termine in porto nazionale, la procedura per il regolamento della contribuzione, a norma degli articoli 469 e seguenti, si svolge avanti il pretore della circoscrizione nella quale il porto e' situato. Se la spedizione o il viaggio contributivo hanno termine in porto straniero, la procedura per il regolamento della contribuzione si svolge avanti il pretore della circoscrizione nella quale e' l'ufficio di iscrizione della nave. 
codice della navigazione	Art. 611. (Domanda di regolamento). L'azione per contribuzione alle avarie comuni si esercita con domanda di regolamento, proposta dall'armatore della nave o da altro interessato nella spedizione, mediante ricorso al pretore, competente ai sensi del precedente articolo. 
codice della navigazione	Art. 612. (Atti preliminari). Il pretore, a seguito della presentazione del ricorso, richiama i verbali dell'investigazione prevista nell'articolo 182, gli atti relativi alla verifica della relazione di eventi straordinari, e quelli dell'inchiesta sommaria prevista nell'articolo 578. Con ordinanza, inoltre, il pretore nomina uno o piu' liquidatori d'avaria, scelti, quando si tratti di navi marittime, nell'elenco speciale a tal uopo formato secondo le norme del regolamento; fissa il termine entro il quale il comandante della nave, quando non l'abbia gia' fatto in adempimento del disposto dell'articolo 304, e' tenuto a depositare presso la cancelleria copia da lui sottoscritta del verbale indicato dall'articolo 314; dispone per una data successiva la convocazione degli interessati, dei quali l'istante ha indicato il nome e il domicilio. La cancelleria procede alla pubblicazione dell'ordinanza nell'albo della pretura e ne informa gli interessati mediante lettera raccomandata con avviso di ricevimento. 
codice della navigazione	Art. 613. (Liquidatori d'avaria). Ai liquidatori d'avaria si applicano le norme del codice di procedura civile relative ai consulenti tecnici. 
codice della navigazione	Art. 614. (Adunanza di discussione). Nel giorno stabilito per la convocazione, il pretore assistito dal liquidatore procede, in presenza degli interessati, all'esame degli atti indicati nel primo comma dell'articolo 612 e dei documenti prodotti. Esaurito tale esame, il pretore fissa con ordinanza il termine entro il quale il liquidatore e' tenuto a depositare, presso la cancelleria, il regolamento contributorio. Il termine di deposito puo' essere prorogato a norma dell'articolo 154 del codice di procedura civile. 
codice della navigazione	Art. 615. (Pubblicazione del deposito del regolamento). La cancelleria procede alla pubblicazione dell'avvenuto deposito del regolamento contributorio nell'albo della pretura, e ne da' comunicazione agli interessati, a norma dell'articolo 136 del codice di procedura civile. 
codice della navigazione	Art. 616. (Impugnazione del regolamento). L'impugnazione del regolamento contributorio e' proposta con ricorso da depositarsi, entro trenta giorni dalla comunicazione di cui al precedente articolo, presso la cancelleria della pretura, se l'ammontare della massa creditoria non supera le lire diecimila, e presso la cancelleria del tribunale, se supera detta somma. Il giudice competente, riuniti i ricorsi depositati e richiamato d'ufficio il regolamento, fissa la data della prima udienza di trattazione, della quale si informano le parti mediante lettera raccomandata con avviso di ricevimento. 
codice della navigazione	Art. 617. (Omologazione del regolamento). Se il regolamento contributorio non e' impugnato, o se le impugnazioni proposte sono rigettate con sentenza passata in giudicato, il pretore, con ordinanza, omologa il regolamento e gli conferisce efficacia di titolo esecutivo. Se una o piu' impugnazioni sono accolte con sentenza passata in giudicato, il pretore dispone, con ordinanza, che lo stesso liquidatore, o altro a tal fine nominato nelle forme di cui all'articolo 612, proceda alla formazione di un nuovo regolamento. Il nuovo regolamento non puo' essere impugnato per motivi che hanno gia' formato oggetto di impugnazione del precedente regolamento. 
codice della navigazione	Art. 618. (Riapertura del regolamento). Nella ipotesi di cui all'articolo 479, il pretore su istanza dell'armatore della nave o di altro interessato dispone la riapertura del regolamento, richiama in ufficio i liquidatori o, se questi non possono essere richiamati, procede a nuova nomina, e provvede a quanto altro e' richiesto nelle precedenti disposizioni, al fine di tener conto del valore delle cose ricuperate. 
codice della navigazione	Art. 619. (Chirografo di avaria). Gli interessati possono, mediante stipulazione di chirografo di avaria, far decidere da arbitri le cause relative alla formazione del regolamento contributorio. Al chirografo e al regolamento si applicano in tal caso le norme del codice di procedura civile riguardanti l'arbitrato, se gli interessati intendono che al regolamento venga dal pretore competente conferita efficacia di sentenza, e di cio' fanno espressa dichiarazione nel chirografo. 
codice della navigazione	Art. 620. (Giudice competente). Il procedimento di limitazione e' promosso avanti il tribunale o il pretore, nella circoscrizione dei quali e' il foro generale dell'armatore, a seconda che si tratti di navi maggiori ovvero di navi minori e di galleggianti. 
codice della navigazione	Art. 621. (Domanda di limitazione). L'armatore che intende valersi del beneficio della limitazione ne propone domanda, con ricorso al giudice competente, ai sensi del precedente articolo. Il ricorso deve indicare il nome, la paternita', la nazionalita' e il domicilio dell'istante; la dichiarazione di residenza o l'elezione di domicilio dell'istante stesso nel comune, in cui ha sede il giudice competente; gli elementi di individuazione della nave, l'ufficio di iscrizione e il luogo dove la nave o il galleggiante si trovano; il viaggio cui le obbligazioni si riferiscono. Insieme con il ricorso, l'armatore deve depositare, a pena di inammissibilita', nella cancelleria del tribunale o della pretura: a) dichiarazione del valore della nave al momento della domanda ovvero, se la domanda e' proposta dopo la fine del viaggio, al termine di questo, nonche', in entrambi i casi, del valore della nave all'inizio del viaggio; b) elenco dei proventi lordi del viaggio; c) copia dell'inventario di bordo secondo le forme stabilite dal regolamento; d) elenco nominativo dei creditori soggetti alla limitazione, con l'indicazione del loro domicilio, del titolo e dell'ammontare del credito di ciascuno; e) certificato delle ipoteche trascritte sulla nave. Su istanza dell'armatore, il presidente del tribunale puo' disporre che il deposito della dichiarazione di valore della nave sia eseguito in un termine successivo alla domanda. Tale termine non deve superare i dieci giorni, ma puo' essere prorogato fino a otto giorni prima della data fissata ai sensi dell'articolo 623 per la presentazione in cancelleria delle domande dei creditori. 
codice della navigazione	Art. 622. (Valutazione della nave). La dichiarazione del valore della nave all'inizio del viaggio deve indicare il valore commerciale secondo le risultanze del Registro italiano navale o dell'ispettorato compartimentale, tenuto conto altresi' delle pertinenze indicate nella copia dell'inventario di bordo di cui alla lettera c dell'articolo precedente. In caso di nave assicurata, si assume per valore commerciale quello che la polizza di assicurazione indica come valore di stima ai sensi dell'articolo 515. 
codice della navigazione	Art. 623. (Sentenza di apertura). Con sentenza esecutiva il tribunale, accertata in seguito alla domanda dell'armatore l'esistenza degli estremi di legge, dichiara aperto il procedimento di limitazione. Con la stessa sentenza il tribunale designa un giudice per la formazione dello stato attivo e di quello passivo, per il riparto della somma e per l'istruzione dei processi, di cui agli articoli 627, 636, 637; assegna ai creditori per la presentazione in cancelleria delle domande e dei titoli un termine non superiore a giorni trenta dalla data di pubblicazione della sentenza, o a sessanta per i creditori residenti all'estero; stabilisce, entro sessanta giorni dalla decorrenza del maggior termine fissato per la presentazione delle domande e dei titoli dei creditori, la data di deposito dello stato attivo e di quello passivo; fissa, non prima di dieci e non oltre venti giorni da quest'ultima data, l'udienza di trattazione delle impugnazioni dello stato attivo e di quello passivo avanti il collegio. 
codice della navigazione	Art. 624. (Notifica e pubblicazione della sentenza di apertura). La sentenza di apertura, a cura della cancelleria, e' portata a conoscenza dell'armatore e dei creditori indicati nell'elenco di cui all'articolo 621, mediante lettera raccomandata con avviso di ricevimento. La sentenza stessa, a cura della cancelleria, e' altresi' trasmessa in estratto all'ufficio di iscrizione della nave o del galleggiante, e, parimenti in estratto, pubblicata nella Gazzetta ufficiale del Regno. L'ufficio di iscrizione, avuto conoscenza della sentenza, ne fa annotazione nel registro di iscrizione della nave o del galleggiante, e ne cura l'affissione nell'albo dell'ufficio stesso. 
codice della navigazione	Art. 625. (Effetti del procedimento sui debiti pecuniari). Agli effetti del procedimento, i debiti pecuniari non scaduti, soggetti alla limitazione, si considerano scaduti alla data di apertura. I crediti sottoposti a condizione partecipano allo stato passivo, e sono compresi con riserva fra i crediti ammessi. I crediti per interessi convenzionali o legali, maturati dopo la data di apertura, sono ammessi a concorrere soltanto sul residuo della somma limite dopo il riparto fra i creditori. 
codice della navigazione	Art. 626. (Improcedibilita' e sospensione di atti esecutivi). Dalla data di pubblicazione della sentenza di apertura i creditori soggetti alla limitazione non possono promuovere l'esecuzione forzata sui beni dell'armatore per le obbligazioni di cui all'articolo 275. Dalla stessa data, il processo di esecuzione iniziato dai creditori medesimi e' sospeso, anche d'ufficio, con provvedimento del giudice dell'esecuzione, e si estingue se non e' riassunto nel termine fissato con la sentenza che fa constare una delle cause di decadenza previste nell'articolo 640. 
codice della navigazione	Art. 627. (Opposizione dei creditori). Contro la sentenza di apertura i creditori possono promuovere opposizione, entro quindici giorni dalla pubblicazione nella Gazzetta ufficiale del Regno, per l'inesistenza degli estremi di legge, in contraddittorio dell'armatore. L'opposizione non sospende il procedimento, a meno che il giudice designato non ne autorizzi, con ordinanza, la sospensione fino a che non sia pronunciata sull'opposizione sentenza passata in giudicato. 
codice della navigazione	Art. 628. (Formazione dello stato attivo). Nel termine fissato dalla sentenza di apertura, il giudice designato, sentiti l'armatore e i creditori concorrenti, forma lo stato attivo sulla base della dichiarazione di valore e dei documenti indicati nell'articolo 621. Egli puo' disporre anche d'ufficio accertamenti tecnici per la revisione del valore della nave dichiarato dall'armatore o sulla consistenza e l'ammontare del nolo e degli altri proventi; in questo caso fissa un termine per il deposito della relazione di stima, durante il quale sospende, ove sia opportuno, il procedimento. 
codice della navigazione	Art. 629. (Deposito della somma limite). Entro tre giorni dalla sentenza di apertura o dal deposito della dichiarazione di valore, disposto ai sensi dell'ultimo comma dell'articolo 621, il giudice designato fissa il termine, non superiore a cinque giorni, e le modalita' per il deposito della somma limite, computata sulla base delle indicazioni e dei documenti presentati dall'armatore, nonche' di una congrua somma per le spese del procedimento. 
codice della navigazione	Art. 630. (Integrazione della somma depositata). Quando, in seguito agli accertamenti tecnici previsti nell'articolo 628, risulta che il valore della nave o l'ammontare dei proventi e' superiore a quello dichiarato, il giudice designato ordina l'integrazione della somma depositata entro un termine non superiore a cinque giorni. Quando dagli accertamenti medesimi risultano proventi omessi o inesattamente indicati dall'armatore per dolo o colpa grave, il giudice designato provvede ai sensi dell'articolo 641. 
codice della navigazione	Art. 631. (Vendita della nave e cessione dei proventi). Se l'armatore proprietario ne fa istanza entro il termine previsto per il deposito della somma limite a sensi dell'articolo 629, il giudice designato, con ordinanza, puo' autorizzare, in luogo del deposito del valore della nave, la vendita all'incanto della nave stessa entro un termine anteriore di almeno dieci giorni alla scadenza di quello fissato per la formazione dello stato attivo. Il giudice predetto, su istanza dell'armatore nel termine previsto per il deposito della somma limite, puo' altresi' autorizzare la cessione alla massa passiva dei proventi esatti, o da esigere entro un termine anteriore di almeno dieci giorni alla scadenza di quello fissato per la formazione dello stato attivo, nominando in tal caso un liquidatore. Venduta la nave o esatti i proventi, il giudice dispone che, entro un termine anteriore di almeno cinque giorni alla scadenza di quello fissato per la formazione dello stato attivo, la somma ricavata sia integrata fino a concorrenza della somma limite. 
codice della navigazione	Art. 632. (Opposizione all'ordinanza di vendita della nave o di cessione dei proventi). Entro dieci giorni dalla pubblicazione dell'ordinanza che autorizza la vendita della nave o la cessione dei proventi, i creditori possono proporre opposizione mediante ricorso al giudice designato, il quale, sentiti l'armatore e i creditori concorrenti, decide con ordinanza non impugnabile. L'opposizione sospende l'esecuzione dell'ordinanza. 
codice della navigazione	Art. 633. (Comunicazione dei provvedimenti del giudice designato). I provvedimenti del giudice designato, indicati negli articoli precedenti, sono comunicati a cura della cancelleria all'armatore e ai creditori mediante lettera raccomandata con avviso di ricevimento. L'ordinanza che autorizza la vendita della nave o la cessione dei proventi e' trasmessa inoltre all'ufficio di iscrizione della nave o del galleggiante, per la pubblicazione mediante affissione nell'albo. 
codice della navigazione	Art. 634. (Formazione dello stato passivo). Nel termine fissato dalla sentenza di apertura, il giudice designato, sentiti l'armatore e i creditori concorrenti, procede alla formazione dello stato passivo. 
codice della navigazione	Art. 635. (Avviso di deposito dello stato attivo e passivo). L'avvenuto deposito dello stato attivo e di quello passivo e' comunicato all'armatore e ai creditori, mediante lettera raccomandata con avviso di ricevimento, nonche' all'ufficio d'iscrizione della nave o del galleggiante, che ne cura la pubblicazione mediante affissione nell'albo. 
codice della navigazione	Art. 636. (Impugnazione dello stato attivo e passivo). Le impugnazioni dello stato attivo e di quello passivo sono proposte in contraddittorio dell'armatore e dei creditori interessati, mediante citazione per l'udienza avanti il collegio, fissata ai sensi dell'articolo 623. Decise le impugnazioni con sentenza passata in giudicato, il giudice designato, ove necessario, provvede alla formazione del nuovo stato attivo e di quello passivo e ordina l'integrazione della somma depositata entro un termine non superiore a cinque giorni. 
codice della navigazione	Art. 637. (Stato di riparto). Decorso il termine fissato per le impugnazioni, ovvero quando il nuovo stato passivo e' formato a norma dell'articolo precedente, i creditori compresi nello stato passivo possono concordare lo stato di riparto. Se i creditori non raggiungono l'accordo, il giudice designato procede alla ripartizione della somma depositata, secondo l'ordine delle cause di prelazione. Lo stato di riparto e' impugnabile, entro dieci giorni dal deposito nella cancelleria, solo per quanto attiene all'ordine di prelazione. Il giudice designato, in base al riparto concordato o a quello definitivamente formato, provvede all'emissione dei mandati di pagamento. 
codice della navigazione	Art. 638. (Ripartizione del residuo). Fermo il disposto dell'ultimo comma dell'articolo 625, sul residuo della somma depositata sono ammessi a concorrere i creditori che abbiano presentata la loro domanda fuori del termine fissato nella sentenza di apertura. Alla ripartizione del residuo si procede a norma dell'articolo precedente, ma lo stato di riparto e' impugnabile anche per motivi attinenti all'esistenza del credito. 
codice della navigazione	Art. 639. (Fallimento dell'armatore). Il fallimento dell'armatore, dichiarato successivamente al decorso del termine fissato per le impugnazioni dello stato attivo, o al passaggio in giudicato della sentenza che respinge le impugnazioni, ovvero alla integrazione della somma disposta ai sensi del secondo comma dell'articolo 636, non estingue il procedimento di limitazione; le somme depositate non sono comprese nella massa attiva fallimentare, e i creditori soggetti alla limitazione non partecipano al concorso sul patrimonio del fallito. 
codice della navigazione	Art. 640. (Decadenza dal beneficio della limitazione). L'armatore decade dal beneficio della limitazione: a) per l'inesatta indicazione o l'omissione, dolose o gravemente colpose, di proventi della spedizione; b) per il mancato deposito, entro il termine fissato, della dichiarazione di valore della nave, disposto ai sensi dell'ultimo comma dell'articolo 622; c) per il mancato deposito, entro il termine fissato, della somma limite o della somma per le spese del procedimento, ovvero per l'omessa integrazione del deposito stesso; d) per l'occultamento della nave ovvero per l'intralcio all'opera dell'esperto nei casi di cui all'articolo 628. 
codice della navigazione	Art. 641. (Dichiarazione di estinzione del procedimento). In caso di fallimento dell'armatore dichiarato prima del momento indicato nell'articolo 639, o quando ricorra uno dei casi previsti nell'articolo precedente, il giudice designato rimette le parti al collegio. Il collegio, accertati gli estremi di cui all'articolo 639 o quelli della decadenza, dichiara estinto, con sentenza, il procedimento di limitazione, ordina la restituzione delle somme depositate, fatta deduzione delle spese, e fissa un termine per la riassunzione dei processi di esecuzione di cui all'articolo 626. La sentenza predetta e' notificata e pubblicata nelle forme di cui all'articolo 624. 
codice della navigazione	Art. 642. (Norme applicabili al procedimento promosso avanti il pretore). Quando si tratta di navi minori o di galleggianti, spettano al pretore tutti i poteri attribuiti dai precedenti articoli al tribunale, al presidente e al giudice designato. Disposizioni generali 
codice della navigazione	Art. 643. (Competenza). L'esecuzione forzata e' promossa avanti il tribunale o il pretore, nella circoscrizione dei quali la nave o il galleggiante si trova, a seconda che oggetto ne siano navi maggiori ovvero navi minori o galleggianti. Il sequestro giudiziario e conservativo di navi o di galleggianti e' autorizzato dai giudici competenti a norma del codice di procedura civile. 
codice della navigazione	Art. 644. (Oggetto dell'espropriazione e delle misure cautelari). Salve le eccezioni contemplate nell'articolo seguente, possono formare oggetto di espropriazione forzata e di misure cautelari le navi e i galleggianti, i loro carati e le loro pertinenze separabili. Se oggetto di espropriazione forzata e di misure cautelari sono carati di navi, il giudice competente puo', sentiti i comproprietari non debitori, autorizzare il pignoramento o il sequestro dell'intera nave, quando la quota del proprietario debitore eccede la meta'; in tal caso, il diritto spettante ai comproprietari non debitori sui carati ad essi appartenenti e' convertito nel diritto alla corrispondente parte del prezzo di aggiudicazione ed e' esente da ogni concorso alle spese delle procedure esecutive e cautelari. 
codice della navigazione	Art. 645. (Navi non soggette a pignoramento e a sequestro). Non possono formare oggetto di espropriazione forzata ne' di misure cautelari: a) le navi da guerra, comprese le navi in costruzione per conto della marina militare nazionale; b) le navi adibite alle linee di navigazione, dichiarate di preminente interesse nazionale dal ministro per le comunicazioni, se non sia intervenuta la autorizzazione del ministro medesimo; c) le navi adibite ai servizi pubblici di linea o di rimorchio della navigazione interna, se non sia intervenuta l'autorizzazione del ministro per le comunicazioni; d) le navi e i galleggianti, pronti a partire o in corso di navigazione, purche' non si tratti di debiti a causa del viaggio che stanno per intraprendere o che proseguono. La nave marittima si reputa pronta a partire quando il comandante ha ricevuto le spedizioni, e la nave della navigazione interna quando il comandante di porto ha dato la relativa autorizzazione. 
codice della navigazione	Art. 646. (Provvedimenti per impedire la partenza della nave). Il giudice competente a sensi dell'articolo 643, e, ove ricorra l'urgenza, il comandante del porto, o l'autorita' di polizia giudiziaria del luogo, nel quale si trova la nave, possono prendere i provvedimenti opportuni per impedire la partenza della nave. 
codice della navigazione	Art. 647. (Precetto). Il precetto e' regolato dalle disposizioni del codice di procedura civile, ma il termine ad adempiere e' ridotto a ventiquattro ore. 
codice della navigazione	Art. 648. (Notificazione del precetto). Il precetto, ad istanza del creditore, deve essere notificato al debitore proprietario. Il precetto diviene inefficace, trascorsi trenta giorni senza che si sia proceduto al pignoramento. Del procedimento di espropriazione forzata 
codice della navigazione	Art. 649. (Giudice dell'esecuzione). L'espropriazione e' diretta da un giudice. Nei procedimenti avanti il tribunale la nomina del giudice dell'esecuzione e' fatta dal presidente, su presentazione, a cura del cancelliere, del fascicolo di cui al terzo comma dell'articolo 653, entro due giorni da che e' stato formato. Nei procedimenti avanti le preture delle quali fanno parte piu' magistrati, la nomina e' fatta dal pretore dirigente a norma del comma precedente. Si applicano al giudice dell'esecuzione gli articoli 174 e 175 del codice di procedura civile. 
codice della navigazione	Art. 650. (Forma del pignoramento di navi o di carati di navi). L'atto di pignoramento deve contenere: 1) l'enunciazione della somma dovuta e del titolo esecutivo, in forza del quale si procede, e della sua spedizione in forma esecutiva; 2) la data della notificazione del precetto; 3) l'ingiunzione al debitore proprietario di astenersi da qualsiasi atto diretto a sottrarre alla garanzia del credito, per la soddisfazione del quale si agisce, la nave o il galleggiante o i carati, che si assoggettano alla espropriazione, e le relative pertinenze; 4) l'intimazione al comandante di non far partire la nave, ovvero, se oggetto dell'espropriazione e' una nave in corso di navigazione, di non far ripartire la nave dal porto di arrivo; 5) gli elementi di individuazione della nave o del galleggiante. Il pignoramento si esegue, su istanza del creditore precettante, mediante notificazione dell'atto al debitore proprietario e al comandante. Se si tratta di nave in corso di navigazione, il giudice competente ai sensi dell'articolo 643 puo' prescrivere che la notificazione dell'atto al comandante sia eseguita per mezzo di telegramma collazionato con avviso di ricevimento, ovvero mediante comunicazione radiotelegrafica degli estremi del pignoramento. Non appena eseguita la notificazione o ritirata la ricevuta regolamentare della comunicazione telegrafica o radiotelegrafica, il creditore invia copia autentica dell'atto all'ufficio di iscrizione della nave o del galleggiante, il quale provvede alla trascrizione nel registro d'iscrizione e, ove si tratti di navi maggiori, anche all'annotazione sull'atto di nazionalita'. Se la nave e' in costruzione, la trascrizione del pignoramento si esegue nel registro delle navi in costruzione. Il detto ufficio e' tenuto a consegnare al creditore un certificato dal quale risulti l'espletamento delle formalita' indicate nel precedente comma. 
codice della navigazione	Art. 651. (Forma del pignoramento di pertinenze separabili). Il pignoramento di pertinenze separabili e' autorizzato dal pretore della circoscrizione, nella quale si trova la nave, su istanza del creditore precettante, sentiti i creditori ipotecari. Esso e' eseguito, secondo le norme del codice di procedura civile, riguardanti il pignoramento di cose mobili, dall'ufficiale giudiziario, il quale cura il deposito delle cose nei magazzini generali o in altro luogo idoneo, e nomina un custode. 
